2025/10/19 下午 11:03:30,影響力發展,專員,0.5,5,3,4,2,3,3,3,3,NA,沒有,4,4,4,4,4,4,4,4,3,3,3,3,3,1,1,3,3,3,1,3,4,3,3,2,3,3,2,"交往一段時間的伴侶，過了甜蜜期，進入磨合期，還在找尋相處的方式。
感覺有些組織要做的事情，因為需要兼顧學校自主性，因此有些要落地到學校有困難的。不過在學校協作上，感覺偏集中在特定幾所已成熟學校，但像是樟湖、拯民，但也感覺量能滿炸的，也聽過幾次清圳校長有說「把機會留給其他學校」",NA,NA,NA,4,3,4,4,4,3,3,2,3,4,4,4,4,4,4,3,3,3,3,3,4,4,2,4,"- 工作彈性，在工時或工作地點安排的彈性（但其實剛進來的時候並沒有覺得會有如此的彈性）
- 人際相處，同事相處很融洽，彼此也會互相鼓勵跟讚美，很能感受到愛
- 增能資源，定期安排很多增能課程，有很多的學習
- 參與學校活動，因為這份工作打開很多台灣地方，了解不同的區域文化","- 現階段覺得自己很投入、也足夠被鼓舞
- 清楚的職涯發展藍圖及薪資級距，在不同職涯發展的薪資級距，何時會去評估個人發展狀況，知道如何調整工作狀況（很務實層面的）","- 最喜歡的是「用企業管理的思維去經營非營利組織」
- 次要喜歡的是「非咎責的文化」、「多元增能課程」",- 領導人交接工作上，覺得目前比較動盪，不清楚又甄離開後的協作方式,NA,3,4,4,4,4,4,4,4,- 在 O3 上面，會安排跟柱督 O3，但因為並非所有人都會跟柱督緊密工作機會，我覺得在回饋上可能會很有限；跟又甄 O3 不會有這個狀況,4,4,4,4,4,4,3,3,3,2,2,我覺得誠致是一個學習型的組織，幫助我反思且塑造更有系統的工作思維與方法；同時，擔任實習生 mentor 也讓我覺得收穫很多，尤其在近期跟實習生 O3 對話中，也感受到作為 mentor 影響他人的感動,3,3,3,4,1.5,1,希望自己能在成為「關鍵人才」的路上持續努力精進，回應到 K10 真的最希望能將誠致在做的事情分享出去，哪天拿下傳善獎的就是誠致！,4,9,沒有太多大的問題讓我覺得不滿意,3,由於明年度又甄將卸任副執行長職務，對於後續的工作協作沒有很清楚，希望這個部分可以在溝通更清楚,無
2025/10/20 上午 2:57:52,影響力發展,專員,2.5,0,4,3,2,2,3,1,2,NA,沒有,4,4,4,3,4,4,4,2,1,3,3,2,3,4,1,3,2,3,1,3,1,2,3,3,3,3,1,還在找平衡的失衡天平,NA,NA,NA,NA,2,4,2,3,2,2,3,3,2,3,4,2,3,4,3,2,2,3,3,3,3,2,3,工作時間與地點的彈性；夥伴人都很好；能為在意的事情/價值觀發聲,"1. 明確的協作界線（後台 vs. 學校/外部單位/外部夥伴等，包含下班時間的來訊）
2. 薪資",工作時間與地點的彈性,協作界線,2,4,3,4,4,4,4,NA,4,不太確定個人發展藍圖指的是什麼，但如果是有一份在講誠致各層級的 title 還有期待的能力值，那會覺得較沒幫助是因為看不到除了當領導層以外的發展方向，對我來說就覺得沒什麼幫助,3,4,3,2,4,4,3,4,2,1,3,"最有意義感：看到參與活動的人有所收穫與感動
持續成長：遇到大挑戰後回顧自己掙扎的時刻",4,1,1,1,0.5,1,像海綿一樣增能，在安全的環境中碰壁受挫，然後長大,2,7,高於及格，但有待加強,4,"突然想到覺得加強的，直接寫在這
【領導人對於任務預估的時間太少】
可理解希望把事情做到 60 分即可，但還是不清楚若事情只做到及格，要如何讓員工有一定的效能感。工作安排時很少會預留處理突發狀況的時間（通常用五天的工時預估），但工作上又蠻常會需要臨時調整",謝謝 HR 朋朋設計的 ES，妳們很讚
2025/10/20 上午 11:18:21,影響力發展,其他,2.5,2,2,3,4,4,4,4,3,NA,沒有,4,3,4,4,4,4,4,3,4,3,4,4,3,2,2,4,4,3,4,4,4,3,3,3,4,4,4,我覺得有點像賽車場的賽車和換輪胎的團隊，後台花大量的時間研究怎麼樣補給、協助學校可以最有效，然後在需要的時間點進場協助。當然會有磨合不好搖搖晃晃的時候，但隨著信任關係的建立，學校與後台的合作就可以更順暢。,NA,NA,NA,3,3,2,2,3,3,3,3,4,4,2,4,4,4,4,3,4,4,4,3,3,4,2,3,每個人都在做自己關心的事，小小的每件事情聚集起來，可以讓整個組織朝著目標前進。,"我希望活動、會議、工作調動的告知可以更具體順暢（往往會有我突然被告知要參加某些會議，可能因為是兼職，有些同步通知的時候會遺漏）
但這算是小缺點，工作自由度、授權程度等各種面向上，我都覺得很好。",如上所述，工作的自由度、授權程度很高，可以嘗試的新事物很多，而且可以慢慢看到自己耕耘的事情長出成果。,"以兼職來說，兼職有的權利義務不太清楚。
舉例而言，我之前有被告知要填寫IDP，但後來也沒有使用到，或者有預告會有O3，但不太確定到底是哪些時候會有。或者我應該參與哪些會議，也常常會沒有被通知，很臨時才知會。我覺得這些就會造成在工作上有點小困擾。我不確定是特例還是通例，但如果有一個比較整體的「年度有哪些活動/不同兼職會邀請參與哪些活動」這類比較具體的盤點安排，我對組織如何運作會比較清晰，也會比較能夠安放自己的位置。",2,3,3,NA,NA,NA,NA,NA,NA,如上所述，「我可以用的」和「我應該知道的」說清楚，我覺得就很有幫助了！,4,4,3,4,4,3,3,4,3,2,4,每次工作到一個瓶頸，就會持續發現自己的不足，而這個不足在組織內，都可以找到新的階梯或方向，來協助自己克服。雖然中間會經過很多的挫折，也需要反覆調整自己的行為習慣，但有餘裕可以練習、嘗試，並透過一次一次會議反思成長，都讓人覺得工作很有意義。,3,3,3,3,1.5,3,目前還沒辦法很確定，但我希望目前正在做的專案可以持續耕耘。,4,8,工作的意義感、自由度與現場的成就感很高。,4,NA,謝謝大家成為工作夥伴，從這個表單裡也有感受到後台滿滿的誠意和希望了解大家的心情！
2025/10/20 下午 6:07:08,營運發展,經理,2.5,10,3,4,4,4,4,4,3,NA,沒有,4,4,4,4,4,4,4,4,4,4,4,4,4,3,3,3,3,3,3,3,3,4,4,4,4,4,4,希望學校現場能夠有資源、有能力、有餘裕的發展教育行動，後台以效率的方式提供支持予學校，一同為願景而努力。,NA,NA,NA,4,4,3,4,4,3,3,4,4,4,4,4,4,4,4,4,4,4,4,4,3,4,1,4,領導團隊有能力又有效率帶領整個組織前進，同時又非常善良溫暖充滿對人的關懷；組織發展方向明確的對應願景目標，有明確的核心價值並實際落實。,回答在下面「職場體驗」，兼職相對不會參與到組織這麼全面的活動以及接收到完整資訊，所以有時候可能透過其他的培育資源的互動， 會產生較高的連結感。,行動方向精準明確，溝通直接了當同時包容性強，資源豐富。,"沒有到不喜歡之處～～
不過如果一定要提出一些覺得可以更好的部分，也許是回饋大多都是比較正面，比較沒有全面性的回饋（包含明確不足之處、可以做得更好的地方），或者不是正面稱讚的回饋都會比較客氣跟婉轉表達（？）不確定私底下有沒有，但如果同事或主管能從合作經驗中提供明確的全面回饋應該很有幫助。",NA,NA,3,NA,3,NA,NA,NA,NA,"自己的身份是兼職所以上述好像大多不太適用，比較明確主要是「相揪 KI 運動」參與過程中可以跟夥伴有更多機會建立關係及互動。其他項目可能不一定會接觸到／或沒有接收到相關資訊。
可能看組織對於兼職（或兼職達某個比例以上）是否期待更密切的連結，評估是否提供上述的職場體驗資源。",4,2,2,3,2,2,2,2,2,2,2,產出能實際提供支持或帶來改變，例如作業工具及方式的優化或增能工作坊的分享。,3,3,3,3,1.5,2,誠致宗旨以科技救國，也滿期待如果有機會參與AI／數位發展／系統化相關專案可能會提高合作意願與緊密的程度。,4,8,整體滿喜歡這個組織（如前面的回答），不過可能目前做的事情比較接近過去做過或是已經會做，自己本身比較沒有明確的新的學習刺激或成長感。,4,NA,NA
2025/10/20 下午 9:45:08,影響力發展,助理,0.5,0,4,3,2,3,4,3,1,NA,沒有,4,4,4,4,3,3,4,3,3,3,3,3,3,2,2,4,4,2,2,3,2,3,3,3,3,2,3,好難描述但應該算是良好的合作關係（？老實說沒有特別參與或了解學校和後台的協作關係，所以沒有特別的想法,NA,NA,NA,NA,2,3,3,3,3,3,3,3,3,3,4,3,4,4,4,3,2,3,3,3,4,1,3,團隊夥伴、工作氛圍,已經很被鼓舞了,過去沒有其他經驗,同上,NA,3,3,NA,4,NA,NA,NA,NA,暫無想法,4,4,3,3,4,4,3,4,4,4,3,提供學伴志工幫助、試著做一些自己不太喜歡的工作但還是完成了,3,1,2,1,0,2,應該是沒有,3,7,就還不錯啊,3,NA,NA
2025/10/20 下午 10:53:29,教學發展,其他,1.5,3,3,4,4,3,4,3,3,NA,有,4,4,3,4,3,3,3,4,3,3,4,4,3,4,4,4,4,4,3,3,3,3,4,4,4,4,4,因為對共同願景有期待，學校和後台不只是工作上的關係或職位差異，更是真正能夠信任和支持彼此的好夥伴，讓老師在現場知道他不是孤單的，後台也會知道我們能信任現場,NA,NA,NA,NA,2,3,2,2,3,3,4,3,4,3,4,4,4,4,3,4,4,4,4,3,4,2,3,領導人和夥伴之間以「人才」為優先考量，在意每個夥伴的感受和狀態，讓人感受到被重視與在意,比較是個人對組織整體的觀察，但也有可能是我有限的認知，我認為有時外界的需求和學校的需求中會有外界和學校需要承擔的責任，但有時在溝通過程中會因為誠致秉持的協作文化和當責態度而由誠致共同承擔，我認為也許可以在界線上有更明確的界定，但當然也有可能是我有限的觀察範圍會有誤差，以上提供參考,1 六大核心價值讓團隊的共識凝聚更加具體，且對於核心價值的認同不只體現在信念層，而是會在實踐層明確執行，也會時常復盤討論與身體力行 2 對教育現場的關注因為從學校教育面向切入，且以辦學方式直面現場，對我來說更能被說服有為教育付出並使之產生改變，相較於其他較多影響力推廣活動的組織，誠致深入現場且長期耕耘的實踐是我認為在投身教育相關組織時看見最能代表偏鄉教育議題的組織,無,3,3,3,NA,3,3,NA,NA,NA,因為目前是兼職，沒有很全面的取得這些資源的資訊，但就增能課程o3等等，我認為已經不達和規劃的很清楚,4,4,3,4,3,3,4,4,4,2,3,陪伴現場老師成長、與老師共同面對並解決問題、與組內夥伴們思考怎麼協助老師在資源取得上更加便捷並增加健康幸福感的體驗設計和產品發展歷程,4,3,3,3,1.5,3,以k10作為里程目標希望可以在這期間完成手邊的資源統合和聯盟資源論述整理，會想要在組別內持續進行面對教學與協助現場老師成長的工作內容,4,10,有意義的工作內容、真正面向現場問題的組織、強而有力且致慧溫暖的領導人們,3,NA,NA
